	Frage	Richtige Antwort	Falsche Antwort 1	Falsche Antwort 2	Falsche Antwort 3	Reaktion richtige Antwort	Reaktion falsche Antwort 1	Reaktion falsche Antwort 2	Reaktion falsche Antwort 3	Related topics/projects	Quelle
Apotheke 2.0	Wie viele Patientenkontakte haben Apotheken in Deutschland pro Jahr?	1 Milliarde 	500 Millionen 	750 Millionen 	1,5 Milliarden 	Du hast den Dreh raus! Laut der Bundesvereinigung deutscher Apothekerverbände haben Apotheken im Jahr 1 Milliarde Patientenkontakte. 	Diese Antwort ist leider zu niedrig. Laut der Bundesvereinigung deutscher Apothekerverbände haben Apotheken im Jahr 1 Milliarde Patientenkontakte. 	Diese Antwort ist leider zu niedrig. Laut der Bundesvereinigung deutscher Apothekerverbände haben Apotheken im Jahr 1 Milliarde Patientenkontakte. 	Diese Antwort ist zu hoch. Laut der Bundesvereinigung deutscher Apothekerverbände haben Apotheken im Jahr 1 Milliarde Patientenkontakte. 	Die Apotheke vor Ort übernimmt eine zentrale Rolle für die regionale Gesundheitsversorgung. Hier am GesundheitsCampus Osnabrück beschäftigt sich eine Forschergruppe der Universität mit der Frage, wie digitale Technologien in Apotheken dafür eingesetzt werden können.	Bundesvereinigung Deutscher Apothekerverbände e. V. (2017): DIE APOTHEKE. Zahlen. Daten. Fakten. 2017. S. 5 
Apotheke 2.0	Wie viele Botendienste werden täglich von deutschen Apotheken durchgeführt?	250.000	120.000	80.000	500.000	Juhu, deine Antwort ist richtig. Laut der Broschüre: "Die Apotheke. Zahlen. Daten. Fakten. 2017" führen deutsche Apotheken täglich 250.000 Botendienste durch. 	Die richtige Antwort liegt höher. Laut der Broschüre: "Die Apotheke. Zahlen. Daten. Fakten. 2017" führen deutsche Apotheken täglich 250.000 Botendienste durch. 	Die richtige Antwort liegt höher. Laut der Broschüre: "Die Apotheke. Zahlen. Daten. Fakten. 2017" führen deutsche Apotheken täglich 250.000 Botendienste durch. 	Die richtige Antwort liegt niedriger. Laut der Broschüre: "Die Apotheke. Zahlen. Daten. Fakten. 2017" führen deutsche Apotheken täglich 250.000 Botendienste durch. 	Die Apotheke vor Ort übernimmt eine zentrale Rolle für die regionale Gesundheitsversorgung. Hier am GesundheitsCampus Osnabrück beschäftigt sich eine Forschergruppe der Universität mit der Frage, wie digitale Technologien in Apotheken dafür eingesetzt werden können.	Bundesvereinigung Deutscher Apothekerverbände e. V. (2017): DIE APOTHEKE. Zahlen. Daten. Fakten. 2017. S. 5 
Apotheke 2.0	Wie viel Prozent aller deutschen Patienten nehmen regelmäßig drei oder mehr Arzneimittel?	88%	22%	45%	10%	Du bist spitze! Laut der Broschüre: "Die Apotheke. Zahlen-Daten-Fakten 2017" nehmen 88% aller deutschen Patienten regelmäßig drei oder mehr Arzneimittel. 	Mit dieser Vermutung hast du leider zu tief gegriffen. Laut der Broschüre: "Die Apotheke. Zahlen-Daten-Fakten 2017" nehmen 88% aller deutschen Patienten regelmäßig drei oder mehr Arzneimittel. 	Mit dieser Vermutung hast du leider zu tief gegriffen. Laut der Broschüre: "Die Apotheke. Zahlen-Daten-Fakten 2017" nehmen 88% aller deutschen Patienten regelmäßig drei oder mehr Arzneimittel. 	Mit dieser Vermutung hast du leider zu tief gegriffen. Laut der Broschüre: "Die Apotheke. Zahlen-Daten-Fakten 2017" nehmen 88% aller deutschen Patienten regelmäßig drei oder mehr Arzneimittel. 	Die Apotheke vor Ort übernimmt eine zentrale Rolle für die regionale Gesundheitsversorgung. Hier am GesundheitsCampus Osnabrück beschäftigt sich eine Forschergruppe der Universität mit der Frage, wie digitale Technologien in Apotheken dafür eingesetzt werden können.	Bundesvereinigung Deutscher Apothekerverbände e. V. (2017): DIE APOTHEKE. Zahlen. Daten. Fakten. 2017. S. 5 
Apotheke 2.0	Wie viele Apotheken haben deutschlandweit gleichzeitig Nacht- und Notdienst?	1.300	500	2.100	850	Cool, deine Antwort ist richtig. Nach Aussage der Bundesvereinigung deutscher Apothekerverbände haben deutschlandweit gleichzeitig 1.300 Apotheken Nacht- und Notdienst. 	Diese Antwort ist zu niedrig. Nach Aussage der Bundesvereinigung deutscher Apothekerverbände haben deutschlandweit gleichzeitig 1.300 Apotheken Nacht- und Notdienst. 	Diese Antwort ist zu hoch. Nach Aussage der Bundesvereinigung deutscher Apothekerverbände haben deutschlandweit gleichzeitig 1.300 Apotheken Nacht- und Notdienst. 	Diese Antwort ist zu niedrig. Nach Aussage der Bundesvereinigung deutscher Apothekerverbände haben deutschlandweit gleichzeitig 1.300 Apotheken Nacht- und Notdienst. 	Die Apotheke vor Ort übernimmt eine zentrale Rolle für die regionale Gesundheitsversorgung. Hier am GesundheitsCampus Osnabrück beschäftigt sich eine Forschergruppe der Universität mit der Frage, wie digitale Technologien in Apotheken dafür eingesetzt werden können.	Bundesvereinigung Deutscher Apothekerverbände e. V. (2017): DIE APOTHEKE. Zahlen. Daten. Fakten. 2017. S. 6
Apotheke 2.0	Ist die Apothekendichte in Deutschland über oder unter dem EU- Schnitt?	Deutschland liegt mit 24 Apotheken/ 100.000 Einwohner unter dem EU Schnitt 	Deutschland liegt mit 24 Apotheken/ 100.000 Einwohner über dem EU Schnitt 	Deutschland liegt mit 24 Apotheken/ 100.000 Einwohners im EU Schnitt	Das lässt sich nicht beantworten. Die Apothekenkultur der verschiedenen Länder unterscheidet sich zu sehr	Deine Antwort ist richtig. Nach Aussage der Bundesvereinigung deutscher Apothekerverbände liegt Deutschland mit 24 Apotheken pro 100.000 Einwohner unter dem EU Schnitt von 31 Apotheken. 	Falsch gedacht. Nach Aussage der Bundesvereinigung deutscher Apothekerverbände liegt Deutschland mit 24 Apotheken pro 100.000 Einwohner unter dem EU Schnitt von 31 Apotheken. 	Leider falsch! Nach Aussage der Bundesvereinigung deutscher Apothekerverbände liegt Deutschland mit 24 Apotheken pro 100.000 Einwohner unter dem EU Schnitt von 31 Apotheken. 	Falsch gedacht. Es ist möglich einen Vergleich anzustellen. Nach Aussage der Bundesvereinigung deutscher Apothekerverbände liegt Deutschland mit 24 Apotheken pro 100.000 Einwohner unter dem EU Schnitt von 31 Apotheken. 	Die Apotheke vor Ort übernimmt eine zentrale Rolle für die regionale Gesundheitsversorgung. Hier am GesundheitsCampus Osnabrück beschäftigt sich eine Forschergruppe der Universität mit der Frage, wie digitale Technologien in Apotheken dafür eingesetzt werden können.	Bundesvereinigung Deutscher Apothekerverbände e. V. (2017): DIE APOTHEKE. Zahlen. Daten. Fakten. 2017.
Apotheke 2.0	Wie hat sich der durchschnittliche Arzneimittelpreis in Deutschland seit 2004 entwickelt?	Er ist um 12,9% gesunken	Er ist um 8,5% gestiegen 	Er ist um 25% gesunken	Er ist um 12,9% gestiegen	Richtig geantwortet. Laut der Broschüre: "Die Apotheke. Zahlen-Daten-Fakten 2017" ist der durchschnittliche Arzneimittelpreis seit 2004 um 12,9% gesunken. 	Deine Antwort ist leider falsch. Laut der Broschüre: "Die Apotheke. Zahlen-Daten-Fakten 2017" ist der durchschnittliche Arzneimittelpreis seit 2004 um 12,9% gesunken. 	Deine Antwort ist leider falsch. Laut der Broschüre: "Die Apotheke. Zahlen-Daten-Fakten 2017" ist der durchschnittliche Arzneimittelpreis seit 2004 um 12,9% gesunken. 	Deine Antwort ist leider falsch. Laut der Broschüre: "Die Apotheke. Zahlen-Daten-Fakten 2017" ist der durchschnittliche Arzneimittelpreis seit 2004 um 12,9% gesunken. 	Die Apotheke vor Ort übernimmt eine zentrale Rolle für die regionale Gesundheitsversorgung. Hier am GesundheitsCampus Osnabrück beschäftigt sich eine Forschergruppe der Universität mit der Frage, wie digitale Technologien in Apotheken dafür eingesetzt werden können.	Bundesvereinigung Deutscher Apothekerverbände e. V. (2017): DIE APOTHEKE. Zahlen. Daten. Fakten. 2017. S. 25
GEva-ISI	Welchen Zustand beschreibt die Begrifflichkeit: Doppelte Informationsasymmetrie? 	Informationsmangel sowohl vom Arzt, als auch vom Patienten 	Informationsmangel vom Arzt gegenüber dem Patienten 	Informationsmangel vom Patienten gegenüber dem Arzt	Aufhebung des Informationsmangels durch neue Technologie 	Ich glaube hier weiß jemand wovon er redet! Deine Antwort ist richtig. 	Deine Antwort ist leider falsch. Die richtige Antwort wäre Informationsmangel sowohl vom Arzt, als auch vom Patienten gewesen. 	Deine Antwort ist leider falsch. Die richtige Antwort wäre Informationsmangel sowohl vom Arzt, als auch vom Patienten gewesen. 	Deine Antwort ist leider falsch. Die richtige Antwort wäre Informationsmangel sowohl vom Arzt, als auch vom Patienten gewesen. 	In dem Projekt geht es um die wissenschaftliche Untersuchung und Nutzenbewertung von Gesundheitsterminals in Apotheken, Krankenhäusern und Medizinischen Versorgungszentren. 	Schäfer, C. (2017): Patientencompliance. Adhärenz als Schlüssel für den Therapieerfolg im Versorgungsalltag. 2. Auflage. Mannheim. Springer Gabler
TiP.De	Schätze doch Mal: Wie viele Menschen werden voraussichtlich im Jahr 2050 in Deutschland an einer Demenz-Erkrankung leiden?	bis zu 3 Millionen Menschen	unter 200.000 Menschen	mindestens 5 Millionen Menschen	ca. 1,5 Millionen Menschen	Eine Punktlandung! Schätzungsweise werden im Jahr 2050 bis zu 3 Millionen Menschen in Deutschland an einer Demenz-Erkrankung leiden, damit wird sich die Anzahl der Erkrankten verdoppeln.	Diese Antwort würde mir auch besser gefallen.Tatsächlich wird geschätzt, dass im Jahr 2050 bis zu 3 Millionen Menschen in Deutschland an einer Demenz-Erkrankung leiden werden. 	Puh, das ist zu hoch! Es werden schätzungsweise bis zu 3 Millionen Menschen im Jahr 2050 in Deutschland an einer Demenz-Erkrankung leiden, damit wird sich die Anzahl der Erkrankten verdoppeln.  	Leider ist das die falsche Antwort. Es werden schätzungsweise bis zu 3 Millionen Menschen im Jahr 2050 in Deutschland an einer Demenz-Erkrankung leiden, damit wird sich die  Anzahl der Erkrankten verdoppeln.  	Das Projekt TIP.DE. entwickelt theaterpädagogische Konzepte, die in die Pflege von Patienten mit Demenz eingebunden werden sollen.	Seeling, S.; Cordes, F.; Höhn, J. (2017):Theater in der Pflege von Menschen mit Demenz . Kurzbeschreibung. In: https://www.hs-osnabrueck.de/fileadmin/HSOS/Homepages/TiP.De/Kurzbeschreibung_TiP.De.pdf (Download am 16.05.2018)  
Die Pflege der Dinge 	Die Pflege von Menschen ist ein wichtiges Thema. Was glaubst du, wie viele Untersuchungen in Deutschland über die Bedeutung von Gegenständen in der Pflege gibt es wohl?	Keine Untersuchungen	über 100 verschiedene Untersuchungen	über 10 verschiedene Untersuchungen	über 500 verschiedene Untersuchungen 	Du liegst richtig - leider. Bisher existieren keine Untersuchungen in Deutschland über die Bedeutung von Gegenständen in der Pflege. Hier klafft eine große Wissenslücke.	Das wäre schön, aber leider liegt die wirkliche Anzahl bei null Untersuchungen. Hier klafft eine große Wissenslücke.	Das ist schon wenig, aber in Wirklichkeit sind es noch weniger. Bisher existieren tatsächlich keine Untersuchungen in Deutschland über die Bedeutung von Gegenständen in der Pflege.	Dann wären wir ja richtige Experten! Leider haben wir noch einen weiten Weg vor uns, denn bisher existieren keine Untersuchungen in Deutschland über die Bedeutung von Gegenständen in der Pflege. 	Der GesundheitsCampus Osnabrück beteiligt sich an dem Projekt "Die Pflege der Dinge", bei dem das Ziel verfolgt wird, die Objekte der Pflege sichtbar zu machen und ihre Bedeutung zu erforschen.	Universität Osnabrück, Institut für GesundheitsForschung und Bildung (Hrsg.): Die Pflege der Dinge – Die Bedeutung von Objekten in Geschichte und gegenwärtiger Praxis der Pflege. Hintergrund. In: https://www.igb.uni-osnabrueck.de/abteilungen/pflegewissenschaft/forschungsfelder/geschichte_theorie_und_ethik/dinge_der_pflege.html (Zugriff am 15.05.2018)
ARinFLEX 	Du hast es bestimmt schon einmal gehört: Augmented Reality! Aber kannst du mir auch beantworten, was Augmented Reality eigentlich bedeutet?	Augmented Reality stellt eine Technologie zur intelligenten Erweiterung der menschlichen Realitätswahrnehmung dar.	Augmented Reality stellt eine Technologie zur intelligenten Reduktion der menschlichen Realitätswahrnehmung dar.	Augmented Reality stellt eine Technologie zur Verbesserung der menschlichen Sehkraft dar.	Augmented Reality ist ein Assistenzsystem, welches ausschließlich in modernen Autos verbaut wird.	Du bist ein Technikexperte, deine Antwort ist korrekt.	Deine Antwort ist leider falsch. Ogmented Riäliti ist eine Technologie zur Erweiterung der Realitätswahrnehmung, indem visuelle, auditive und haptische Informationen überlagert werden.	Deine Antwort ist leider falsch. Ogmented Riäliti ist eine Technologie zur Erweiterung der Realitätswahrnehmung, indem visuelle, auditive und haptische Informationen überlagert werden.	Deine Antwort ist leider falsch.Ogmented Riäliti ist eine Technologie zur Erweiterung der Realitätswahrnehmung, indem visuelle, auditive und haptische Informationen überlagert werden.	Auch der GesundheitsCampus Osnabrück beschäftigt sich mit dem präsenten Thema Augmented Reality. In dem Projekt ARinFLEX wird der Frage nachgegangen, wie der Gesundheits- und Krankenpflegeprozess durch Ogmented Riäliti unterstützt werden kann.	ARinFLEX (o.J.): Augmented Reality. In: http://vmkrcmar77.informatik.tu-muenchen.de/wordpress/?page_id=16 (Zugriff am 14.05.2018)
StanDerm	Was vermutest du -wie viel Prozent aller Berufserkrankungen in Europa sind Hauterkrankungen?	ca. 40%	weniger als 10%	weniger als 2%	mehr als 60%	Nicht schlecht, du bist ein richtiger Könner. Tatsächlich machen Hautkrankheiten ca. 40 % aller Berufskrankheiten in Europa aus. 	Leider falsch! Du hast die Häufigkeit von berufsbedingten Hautkrankheiten unterschätzt. Tatsächlich machen Hautkrankheiten ca. 40% aller Berufskrankheiten in Europa aus.	Leider falsch! Du hast die Häufigkeit von berufsbedingten Hautkrankheiten unterschätzt. Tatsächlich machen Hautkrankheiten ca. 40% aller Berufskrankheiten in Europa aus.	Über 60%, das ist hoch - zu hoch. Tatsächlich machen Hautkrankheiten ca. 40% aller Berufskrankheiten in Europa aus. 	Der GesundheitsCampus Osnabrück unterstützt das Projekt "StandDerm" mit dem Ziel, europäische Standards für die Bekämpfung berufsbedingter Hautkrankheiten zu entwickeln und so dem beschriebenen Problem entgegenzuwirken.	STANDERM (o.J.): Common European standards on occupational skin disease prevention and patient management  COST Action TD1206. In: http://www.standerm.eu/no_cache/standerm.html (Zugriff am 14.05.2018)
GrundGesund 	In welchem Alter ist die Empfänglichkeit für das Erlernen von gesundheits- und krankheitsbezogenen Einstellungen und Verhaltensansätzen besonders hoch?	Im Grundschulalter	Im Erwachsenenalter	Im Rentenalter	Im Kleinkindalter	Super, du hast die richtige Antwort gewählt! Experten sagen, dass die Empfänglichkeit insbesondere im Grundschulalter hoch ist. Ganz nach dem Motto "früh übt sich, wer ein Meister werden will".	Man lernt nie aus, auch nicht im Erwachsenenalter. Experten sagen allerdings, dass die Empfänglichkeit insbesondere im Grundschulalter hoch ist. Deine Antwort ist damit leider falsch.	Man lernt nie aus, auch nicht im Rentenalter. Experten sagen allerdings, dass die Empfänglichkeit insbesondere im Grundschulalter hoch ist. Deine Antwort ist damit leider falsch.	Der Spruch lautet zwar "früh übt sich, wer ein Meister werden will", aber du hast leider zu viel erwartet. Experten sagen nämlich, dass die Empfänglichkeit insbesondere im Grundschulalter hoch ist.	Diese Erkenntnis wurde zum Anlass genommen, um Konzepte für die  Förderung der Gesundheit von Kindern im Grundschulalter sowie der schulischen Gesundheitsförderung zu entwickeln.	Bundeszentrale für gesundheitliche Aufklärung (2013): Prävention und Gesundheitsförderung in Deutschland. In: https://www.fruehehilfen.de/fileadmin/user_upload/fruehehilfen.de/pdf/Publikation_BZgA_Sonderheft_01_Praevention_und_Gesundheitsfoerderung_in_Deutschland.pdf (Zugriff am 16.05.2018) 
 MusikPhysioAnalysis	Wie viele professionelle Orchestermusiker leiden in Deutschland an spürbaren körperlichen Beschwerden bei der Arbeit?	Jeder zweite professionelle Orchesterspieler	Jeder professionelle Orchesterspieler	Jeder fünfte  professionelle Orchesterspieler	Jeder zehnte professionelle Orchesterspieler	Gratuliere, deine Antwort ist korrekt! Aus einer Studie geht hervor, dass tatsächlich jeder zweite professionelle Orchesterspieler in Deutschland an spürbaren körperlichen Beschwerden bei der Arbeit leidet.	Puh, diese Antwort ist falsch. Aus einer Studie geht hervor, dass tatsächlich jeder zweite professionelle Orchesterspieler in Deutschland an spürbaren körperlichen Beschwerden bei der Arbeit leidet.	Deine Antwort ist leider falsch. Aus einer Studie geht hervor, dass tatsächlich jeder zweite professionelle Orchesterspieler in Deutschland an spürbaren körperlichen Beschwerden bei der Arbeit leidet.	Deine Antwort ist leider falsch. Aus einer Studie geht hervor, dass tatsächlich jeder zweite professionelle Orchesterspieler in Deutschland an spürbaren körperlichen Beschwerden bei der Arbeit leidet.	In dem Projekt "MusikPhysioAnalysis" wird eine grundlegende Bewegungsanalyse von verschiedenen Musikern durchgeführt, um eine effektive physiotherapeutische Strategie zur Behandlung zu entwickeln, die den musikerassoziierten Erkrankungen entgegenwirken soll. 	Gembris, H. u. Heye, A. (2012): Älter werden im Orchester. Eine empirische Studie zu Erfahrungen, Einstellungen, Performanz und Lebensperspektiven von professionellen Orchestermusikern. In: https://www.dov.org/system/files/2017-12/2012-04-17_Gembris_und_Heye_Aelter_werden_im_Orchester.pdf (Zugriff am 16.05.2018)
IT-Report 	Wie viele Krankenhäuser in Deutschland haben ein elektronisches Pflegedokumentationssystem krankenhausweit umgesetzt?	22%	72%	35%	5%	Deine Antwort ist richtig, du bist super!	Das wäre schön, aber so fortschrittlich sind die deutschen Krankenhäuser noch nicht. Die richtige Antwort wäre laut EiTie-Report 22% gewesen. 	Knapp daneben ist auch vorbei. Die richtige Antwort wäre laut EiTie-Report 22% gewesen. Hoffentlich verbessert sich die Situation in den deutschen Krankenhäusern bald. 	Da schätzt du die Digitalisierung in deutschen Krankenhäusern aber schlechter ein, als sie ist. Die richtige Antwort wäre laut EiTie-Report 22% gewesen. 	Der EiTie-Report Gesundheitswesen stellt eine regelmäßig durchgeführte Befragung von leitenden Personen in Krankenhäusern  dar. Er informiert Einrichtungen des Gesundheitswesens, der Wissenschaft, der EiTie-Industrie und der Politik über den aktuellen Stand der Nutzung von spezifischen Systemen und gibt eine Trendprognose für die kommenden Jahre.	Hübner, U.; Esdar, M.; Hüsers, J.; Liebe, J.-D.; Rauch, S.; Thye, J. u. Weiß,  J.-P. (o.J.): IT-Report Gesundheitswesen. Hochschule Osnabrück 
IT-Report 	Wie viele deutsche Krankenhäuser haben eine krankenhausweite WLAN-Abdeckung?	40%	65%	20%	80%	Richtig gewählt, ich bin beeindruckt. 	Leider ist diese Antwort falsch. Laut EiTie-Report haben gerade einmal 40% der deutschen Krankenhäuser WLAN. Die Verbesserung des WLANs in deutschen Krankenhäusern würde auch mir einen großen Nutzen bringen. 	Diese Antwort ist zu niedrig und somit falsch. Laut EiTie-Report haben 40% der deutschen Krankenhäuser WLAN. 	Leider ist diese Antwort falsch. Laut EiTie-Report haben gerade einmal 40% der deutschen Krankenhäuser WLAN. Die Verbesserung des WLANs in deutschen Krankenhäusern würde auch mir einen großen Nutzen bringen. 	Der EiTie-Report Gesundheitswesen stellt eine regelmäßig durchgeführte Befragung von leitenden Personen in Krankenhäusern  dar. Er informiert Einrichtungen des Gesundheitswesens, der Wissenschaft, der EiTie-Industrie und der Politik über den aktuellen Stand der Nutzung von spezifischen Systemen und gibt eine Trendprognose für die kommenden Jahre.	Hübner, U.; Esdar, M.; Hüsers, J.; Liebe, J.-D.; Rauch, S.; Thye, J. u. Weiß,  J.-P. (o.J.): IT-Report Gesundheitswesen. Hochschule Osnabrück 
IT-Report 	Woran scheitern IT-Projekte zumeist aus Sicht von IT-Leitern?	Das Kerngeschäft nimmt zu viel Zeit in Anspruch	Widerstände der Anwender	Schlechte Nutzbarkeit der Anwendungen	Es gibt keine Projektideen 	Hätte ich einen Hut auf, dann würde ich ihn ziehen. Wahnsinn, deine Antwort ist richtig. 	Diese Antwort ist nicht richtig. Laut EiTie-Report scheitern Projekte aus Sicht der EiTie-Leiter, weil die Kerngeschäfte zu viel Zeit in Anspruch nehmen. 	Diese Antwort ist nicht richtig. Laut EiTie-Report scheitern Projekte aus Sicht der EiTie-Leiter, weil die Kerngeschäfte zu viel Zeit in Anspruch nehmen. 	Diese Antwort ist nicht richtig. Laut EiTie-Report scheitern Projekte aus Sicht der EiTie-Leiter, weil die Kerngeschäfte zu viel Zeit in Anspruch nehmen. 	Der EiTie-Report Gesundheitswesen stellt eine regelmäßig durchgeführte Befragung von leitenden Personen in Krankenhäusern  dar. Er informiert Einrichtungen des Gesundheitswesens, der Wissenschaft, der EiTie-Industrie und der Politik über den aktuellen Stand der Nutzung von spezifischen Systemen und gibt eine Trendprognose für die kommenden Jahre.	Hübner, U.; Esdar, M.; Hüsers, J.; Liebe, J.-D.; Rauch, S.; Thye, J. u. Weiß,  J.-P. (o.J.): IT-Report Gesundheitswesen. Hochschule Osnabrück 
IT-Report 	Wie viele Krankenhäuser stellen Arztbriefe nicht elektronisch für niedergelassene Ärzte zur Verfügung?	82%	71%	48%	20%	Ich bin begeistert, deine Antwort ist richtig! 	Leider liegt die richtige Antwort nach Aussage des EiTie-Reports noch höher und zwar bei 82%. 	Leider liegt die richtige Antwort nach Aussage des EiTie-Reports noch höher und zwar bei 82%. 	Leider liegt die richtige Antwort nach Aussage des EiTie-Reports noch höher und zwar bei 82%. 	Der EiTie-Report Gesundheitswesen stellt eine regelmäßig durchgeführte Befragung von leitenden Personen in Krankenhäusern  dar. Er informiert Einrichtungen des Gesundheitswesens, der Wissenschaft, der EiTie-Industrie und der Politik über den aktuellen Stand der Nutzung von spezifischen Systemen und gibt eine Trendprognose für die kommenden Jahre.	Hübner, U.; Esdar, M.; Hüsers, J.; Liebe, J.-D.; Rauch, S.; Thye, J. u. Weiß,  J.-P. (o.J.): IT-Report Gesundheitswesen. Hochschule Osnabrück 
	Welches ist die häufigste berufliche Krebserkrankung?	Hautkrebs 	Lungenkrebs	Magenkrebs 	Darmkrebs 	Super gemacht, ich bin beeindruckt! Mit einem Anteil von etwa 10% und 8.729 Erkrankten, im Jahr 2017, ist Hautkrebs die dritthäufigste gemeldete Berufskrankheit. Mach weiter so! 	Leider hast du die falsche Antwort gewählt, denn richtig wäre Hautkrebs gewesen. Mit einem Anteil von etwa 10% und 8.729 Erkrankten, im Jahr 2017, ist Hautkrebs die dritthäufigste gemeldete Berufskrankheit. 	Leider hast du die falsche Antwort gewählt, denn richtig wäre Hautkrebs gewesen. Mit einem Anteil von etwa 10% und 8.729 Erkrankten, im Jahr 2017, ist Hautkrebs die dritthäufigste gemeldete Berufskrankheit. 	Leider hast du die falsche Antwort gewählt, denn richtig wäre Hautkrebs gewesen. Mit einem Anteil von etwa 10% und 8.729 Erkrankten, im Jahr 2017, ist Hautkrebs die dritthäufigste gemeldete Berufskrankheit. 		
	Wie viele Menschen sterben in deutschen Krankenhäusern jährlich an Infektionen durch Hospitalkeime, die sie erst im Krankenhaus erwerben?	ca. 10.000	ca. 5.000	ca. 2.500	ca. 20.000	Sehr gute Entscheidung! Jährlich sterben etwa 10.000 Menschen an im Krankenhaus erworbenen nosokomialen Infektionen. Besonders gefährdet sind ältere Menschen und Personen mit eingeschränktem Immunsytsem. 	Daneben! Die richtige Antwort hätte über deiner Vermutung gelegen und wäre 10.000 gewesen. 	Daneben! Die richtige Antwort hätte über deiner Vermutung gelegen und wäre 10.000 gewesen. 	Daneben! Die richtige Antwort hätte unter deiner Vermutung gelegen und wäre 10.000 gewesen. 		
	Welches ist ein besonderer Risikofaktor für die Infektion von Krankenhauspersonal mit multiresistenten Hospitalkeimen? 	Ein vorbestehendes Handekzem 	Eine erhöhte Stressbelastung 	Eine genetische Prädisposition 	Ein ungesunder Lebensstil 	Richtig! Und das Problem ist, dass die Häufigkeit von Handekzemen bei Beschäftigten im Gesundheitswesen derzeit zwischen 15 und 20% liegt. Ursache ist zum Beispiel die Hautbelastung durch langes Handschuhe tragen. 	Schade, das war leider nicht richtig. Die richtige Lösung wäre Handekzem gewesen. Lass den Kopf nicht hängen und versuche es erneut. 	Schade, das war leider nicht richtig. Die richtige Lösung wäre Handekzem gewesen. Lass den Kopf nicht hängen und versuche es erneut. 	Schade, das war leider nicht richtig. Die richtige Lösung wäre Handekzem gewesen. Lass den Kopf nicht hängen und versuche es erneut. 		
