	Frage	Richtige Antwort	Falsche Antwort 1	Falsche Antwort 2	Falsche Antwort 3	Reaktion richtige Antwort	Reaktion falsche Antwort 1	Reaktion falsche Antwort 2	Reaktion falsche Antwort 3	Related topics/projects	Quelle
BGM in der Pflege	Wie hoch ist der Mangel an vollzeitäquivalenten Pflegekräften bis 2030, wenn keine Gegenmaßnahmen ergriffen werden?	Etwa 500.000 Stellen 	Zwischen 10.000 und 20.000 Stellen	Zwischen 100.000 und 200.000 Stellen 	Etwa 700.000 Stellen	Super entschieden. Laut Pflegereport der Bertelsmann Stiftung werden im Jahr 2030 fast 500.000 Vollzeitkräfte in der Pflege fehlen, wenn sich die gegenwärtigen Trends fortsetzen. Hier besteht Handlungsbedarf. 	Mit deiner Antwort liegst du leider zu tief. Laut Pflegereport der Bertelsmann Stiftung werden im Jahr 2030 fast 500.000 Vollzeitkräfte in der Pflege fehlen. Hier besteht Handlungsbedarf.   	Mit deiner Antwort liegst du leider zu tief. Laut Pflegereport der Bertelsmann Stiftung werden im Jahr 2030 fast 500.000 Vollzeitkräfte in der Pflege fehlen. Hier besteht Handlungsbedarf.   	Mit deiner Antwort liegst du zum Glück zu hoch. Laut Pflegereport der Bertelsmann Stiftung werden im Jahr 2030 fast 500.000 Vollzeitkräfte in der Pflege fehlen. Hier besteht Handlungsbedarf.   	Das Betriebliche Gesundheitsmanagement in der Pflege stärkt die Gesundheit der Pflegekräfte, um nachhaltig die Pflegebranche in der Region zu unterstützen. Ziel ist die Entwicklung eines Handlungsleitfadens für ambulanten Pflegeeinrichtungen und Krankenhäuser sowie die Begleitung der Einrichtungen bei der Einführung von Präventionsmaßnahmen.	Bertelsmann Stiftung (2018): Die Versorgungslücke in der Pflege wächst. In: https://www.bertelsmann-stiftung.de/de/unsere-projekte/pflege-vor-ort/projektthemen/pflegereport-2030/ (Download am 24.05.2018)
BGM in der Pflege	Wie war das Versorgungsverhältnis zwischen ambulanter Pflege und Angehörigenpflege im Jahr 2015?	1/3 zu 2/3	1/2 zu 1/2	2/3 zu 1/3	3/4 zu 1/4	Du scheinst mir ein Fachexperte auf diesem Gebiet zu sein. Deine Antwort ist richtig. 	Die Versorgung von pflegebedürftigen Menschen durch ihre Angehörigen ist höher, als du vermutest. Tatsächlich werden zwei Drittel der Pflegebedürftigen durch Angehörige und ein Drittel durch die ambulante Pflege versorgt.	Die Versorgung von pflegebedürftigen Menschen durch ihre Angehörigen ist höher, als du vermutest. Tatsächlich werden zwei Drittel der Pflegebedürftigen durch Angehörige und ein Drittel durch die ambulante Pflege versorgt.	Die Versorgung von pflegebedürftigen Menschen durch den ambulanten Pflegedienst liegt unter deiner Vermutung. Tatsächlich werden zwei Drittel der Pflegebedürftigen durch Angehörige und ein Drittel durch die ambulante Pflege versorgt.	Das Betriebliche Gesundheitsmanagement in der Pflege stärkt die Gesundheit der Pflegekräfte, um nachhaltig die Pflegebranche in der Region zu unterstützen. Ziel ist die Entwicklung eines Handlungsleitfadens für ambulanten Pflegeeinrichtungen und Krankenhäuser sowie die Begleitung der Einrichtungen bei der Einführung von Präventionsmaßnahmen.	
10 Jahre Interdisziplinäre Palliativweiterbildung	Palliative Care setzt in Situationen an...	in denen Patienten unter einer unheilbaren, weit fortgeschrittenen und fortschreitenden Erkrankung leiden	in denen Patienten sich in der Sterbephase befinden 	in denen Patienten eine Intensivbehandlung wünschen	in denen Patienten keinen anderen Ausweg mehr wissen 	Super, richtig entschieden! Wenn du so weiter machst, dann knackst du den Highscore! 	Das ist leider die falsche Antwort. Die Unterstützung durch Palliative Care setzt bereits vor der Terminalphase, mit der Diagnose der unheilbaren, fortschreitenden Krankheit an.	Falsch. Die Unterstützung durch Palliative Care setzt mit der Diagnose einer unheilbaren, fortschreitenden Krankheit an und meint eine Betreuung und gesundheitliche Versorgung bis zum Tod des Patienten.	Falsch. Die Unterstützung durch Palliative Care setzt mit der Diagnose einer unheilbaren, fortschreitenden Krankheit an und meint eine Betreuung und gesundheitliche Versorgung bis zum Tod des Patienten.	Der Lehrgang unterteilt sich in einen berufsspezifischen und einen interdisziplinären Teil. Die Teilnehmenden setzen das erlernte Wissen in einer interdisziplinären Projektarbeit um, die durchgeführt, dokumentiert und zum Lehrgangsabschluss präsentiert wird.	
10 Jahre Interdisziplinäre Palliativweiterbildung	Wie viel Prozent der sterbenden Menschen in Deutschland würden sich wünschen in der eigenen Häuslichkeit zu sterben?	Etwa 90%	Etwa 50%	Etwa 20%	Etwa 70%	Cool, deine Antwort ist richtig. Herzlichen Glückwunsch. 	Deine Vermutung liegt zu tief. Tatsächlich wünschen sich etwa 90% der sterbenden Menschen in der eigenen Häuslichkeit zu sterben. 	Deine Vermutung liegt zu tief. Tatsächlich wünschen sich etwa 90% der sterbenden Menschen in der eigenen Häuslichkeit zu sterben. 	Deine Vermutung liegt zu tief. Tatsächlich wünschen sich etwa 90% der sterbenden Menschen in der eigenen Häuslichkeit zu sterben. 	Der Lehrgang unterteilt sich in einen berufsspezifischen und einen interdisziplinären Teil. Die Teilnehmenden setzen das erlernte Wissen in einer interdisziplinären Projektarbeit um, die durchgeführt, dokumentiert und zum Lehrgangsabschluss präsentiert wird.	Albrecht, W.; Janke, K.; Thomas, S. u. Graf-Baumann, T. (2016): Aktuelle Rechtsfragen der Palliativversorgung. Heidelberg. Springer
10 Jahre Interdisziplinäre Palliativweiterbildung	Wie viel Prozent der verstorbenen Patienten in Deutschland benötigen pro Jahr eine Palliativversorgung?	Etwa 90%	Etwa 60%	Etwa 20%	Etwa 50%	Richtig! Nach den Schätzungen der Deutschen Gesellschaft für Palliativmedizin benötigen 90% der etwa 850.000 verstorbenen Menschen pro Jahr eine Palliativversorgung.	Deine Antwort ist leider zu niedrig. Nach den Schätzungen der Deutschen Gesellschaft für Palliativmedizin benötigen 90% der etwa 850.000 verstorbenen Menschen pro Jahr eine Palliativversorgung.	Deine Antwort ist leider zu niedrig. Nach den Schätzungen der Deutschen Gesellschaft für Palliativmedizin benötigen 90 Prozent der etwa 850.000 verstorbenen Menschen pro Jahr eine Palliativversorgung.	Deine Antwort ist leider zu niedrig. Nach den Schätzungen der Deutschen Gesellschaft für Palliativmedizin benötigen 90% der etwa 850.000 verstorbenen Menschen pro Jahr eine Palliativversorgung.	Der Lehrgang unterteilt sich in einen berufsspezifischen und einen interdisziplinären Teil. Die Teilnehmenden setzen das erlernte Wissen in einer interdisziplinären Projektarbeit um, die durchgeführt, dokumentiert und zum Lehrgangsabschluss präsentiert wird.	Radbruch, L., Andersohn, F. und Walker, J. (2015):Überversorgung kurativ –  Unterversorgung palliativ? Analyse ausgewählter  Behandlungen am Lebensende. In: https://www.bertelsmann-stiftung.de/fileadmin/files/BSt/Publikationen/GrauePublikationen/Studie_VV__FCG_Ueber-Unterversorgung-palliativ.pdf (Download am 24.05.2018)   
...											